{
  "source_id": "pdi_ddefc34bc360",
  "source_type": "guidance_pdi",
  "source_url": "https://www.canada.ca/en/immigration-refugees-citizenship/corporate/publications-manuals/operational-bulletins-manuals/temporary-residents/foreign-workers/public-policy-competitiveness-economy/c52.html",
  "canonical_url": "https://www.canada.ca/en/immigration-refugees-citizenship/corporate/publications-manuals/operational-bulletins-manuals/temporary-residents/foreign-workers/public-policy-competitiveness-economy/c52.html",
  "title": "Academic award recipients for research work – [R205(c)(ii) – C52] – Canadian interest – International Mobility Program",
  "language": "en",
  "manual": "Academic award recipients for research work – [R205(c)(ii) – C52] – Canadian interest – International Mobility Program",
  "chapter": null,
  "heading_path": [
    "Academic award recipients for research work – [R205(c)(ii) – C52] – Canadian interest – International Mobility Program"
  ],
  "last_updated": "2024-12-24",
  "crawl_ts": "2026-02-12T00:00:00Z",
  "http": {
    "status_code": 200,
    "content_type": "text/markdown"
  },
  "content_hash": "aa224936ca9be802f6e301273fba31772877f8e20795adfe78f63139f7e3a591",
  "raw_html_path": null,
  "markdown_path": "scripts/scraper/ircc_data_clean/c52-ddefc34bc3.md",
  "text": "Published Time: Thu, 12 Feb 2026 00:43:31 GMT\n\nAcademic award recipients for research work – [R205(c)(ii) – C52] – Canadian interest – International Mobility Program\n======================================================================================================================\n\nThis section contains policy, procedures and guidance used by IRCC staff. It is posted on the department’s website as a courtesy to stakeholders.\n\nEffective immediately, most foreign nationals in Canada are no longer eligible to apply for a work permit at a port of entry.\n\nThe following work permit applications are exempt from the above restrictions and may still be accepted for processing at a port of entry:\n\n* **applicants who are citizens or permanent residents of the United States of America (USA)**\n* **professionals and technicians under free trade agreements (FTAs)**\n * professionals under the FTA with the USA and Mexico (T36)\n * professionals under the FTA with Chile (F22)\n * contractual service suppliers or independent professionals under the FTA with South Korea (F32)\n * professionals under the FTA with Panama (F42)\n * professionals or technicians under the FTA with Colombia (F12)\n * professionals or technicians under the FTA with Peru (F52)\n\n* **spouses or common-law partners**of applicants under the FTAs with South Korea (F32), Panama (F42) and Colombia (F12)\n* **truck drivers** who are required to depart Canada for the purpose of their employment and, prior to their departure from Canada, held a work permit or maintained status as a result of a pending application for work permit renewal (this does not include truck drivers operating solely within Canada)\n* **applicants with pre-scheduled Canada Border Services Agency (CBSA) appointments**\n\nIn these instructions, “officer” refers to employees of both Immigration, Refugees and Citizenship Canada (IRCC) and the Canada Border Services Agency.\n\nThe instructions on this page should be reviewed in conjunction with\n\n* [Employer-specific work permits — General processing — International Mobility Program](https://www.canada.ca/en/immigration-refugees-citizenship/corporate/publications-manuals/operational-bulletins-manuals/temporary-residents/foreign-workers/eligibility/employer-specific-labout-market-impact-assessment-exemptions.html)\n* [Conditions and validity period on work permits](https://www.canada.ca/en/immigration-refugees-citizenship/corporate/publications-manuals/operational-bulletins-manuals/temporary-residents/foreign-workers/eligibility/eligibility-admissibility-conditions-including-validity-period.html)\n* [Public list of Employers who have been non-compliant](https://www.canada.ca/en/immigration-refugees-citizenship/corporate/publications-manuals/operational-bulletins-manuals/temporary-residents/foreign-workers/eligibility/public-list-employers-who-have-been-non-compliant.html)\n\nThe Minister has designated the work performed by foreign nationals who have received a reward for academic excellence as necessary for public policy reasons related to the competitiveness of Canada’s academic institutions, or economy, under [subparagraph 205(c)(ii) of the Immigration and Refugee Protection Regulations (IRPR)](https://laws-lois.justice.gc.ca/eng/regulations/SOR-2002-227/section-205.html).\n\nOn this page\n------------\n\n* [Eligibility](https://www.canada.ca/en/immigration-refugees-citizenship/corporate/publications-manuals/operational-bulletins-manuals/temporary-residents/foreign-workers/public-policy-competitiveness-economy/c52.html#eligibility)\n* [Documentary evidence](https://www.canada.ca/en/immigration-refugees-citizenship/corporate/publications-manuals/operational-bulletins-manuals/temporary-residents/foreign-workers/public-policy-competitiveness-economy/c52.html#documentary-evidence)\n* [Global Case Management System (GCMS) fields to review in the offer of employment](https://www.canada.ca/en/immigration-refugees-citizenship/corporate/publications-manuals/operational-bulletins-manuals/temporary-residents/foreign-workers/public-policy-competitiveness-economy/c52.html#gcms)\n* [Awards funded by Canadian institutions](https://www.canada.ca/en/immigration-refugees-citizenship/corporate/publications-manuals/operational-bulletins-manuals/temporary-residents/foreign-workers/public-policy-competitiveness-economy/c52.html#award)\n* [Awards funded by foreign institutions](https://www.canada.ca/en/immigration-refugees-citizenship/corporate/publications-manuals/operational-bulletins-manuals/temporary-residents/foreign-workers/public-policy-competitiveness-economy/c52.html#award-1)\n* [Self-funded research](https://www.canada.ca/en/immigration-refugees-citizenship/corporate/publications-manuals/operational-bulletins-manuals/temporary-residents/foreign-workers/public-policy-competitiveness-economy/c52.html#research)\n* [Previous updates](https://www.canada.ca/en/immigration-refugees-citizenship/corporate/publications-manuals/operational-bulletins-manuals/temporary-residents/foreign-workers/public-policy-competitiveness-economy/c52.html#updates)\n\nFor the purposes of the administrative code C52, IRCC defines “academic award” as an award that involves research work, including remuneration, offered by a Canadian academic institution. An academic award is granted strictly on the basis of academic excellence.\n\nEligibility\n-----------\n\nTo be eligible for a work permit issued under administrative code C52, a foreign national must\n\n* be the direct recipient of the award involving work and remuneration\n* hold an official position or an affiliation or registration with a credible academic or educational institution or agency in their country of citizenship or residence\n* demonstrate academic excellence or expertise in a field related to the particular work to be undertaken\n* be offered a position by a credible Canadian academic or educational institution or agency, or a closely affiliated organization \n * The employer must not be a commercial enterprise.\n * For institutions or agencies not on the [designated learning institutions list](https://www.canada.ca/en/immigration-refugees-citizenship/corporate/publications-manuals/operational-bulletins-manuals/temporary-residents/study-permits/designated-learning-institutions.html), see also [Scholarships for international students](https://www.international.gc.ca/world-monde/study_work_travel-etude_travail_voyage/scholarships-bourses.aspx?lang=eng).\n * be offered a position that reflects their experience and expertise and that will have a significant role that will actively contribute to and benefit a Canadian research project\n\n**Note:** Credibility of the employer may be assessed by examining the mandate and capacity of the institution or agency. Is its primary function to engage in research activities or advance education or policy? Does it possess the capacity (for example, resources, expertise, network) to conduct or support research activities? What is its source of funds (for example, government, commercial enterprise)? What kind of reputation does the institution or agency have?\n\nDocumentary evidence\n--------------------\n\nThe following documents should be submitted with the work permit application:\n\n* either \n * an offer of employment number generated by the Employer Portal when the Canadian institution submits the offer, or\n * the Offer of Employment to a Foreign National Exempt from a Labour Market Impact Assessment (LMIA) form [IMM 5802] **if authorized** for the Canadian institution to use by the Client Experience Branch or Immigration Program Guidance Branch to submit the form (see [Alternate submission [IMM 5802]](https://www.canada.ca/en/immigration-refugees-citizenship/corporate/publications-manuals/operational-bulletins-manuals/temporary-residents/foreign-workers/eligibility/employer-specific-labout-market-impact-assessment-exemptions.html#t4) for details)\n\n* proof of payment of the employer compliance fee\n* evidence of the award received (letter from the entity providing the award that details how it meets the award criteria) \n* evidence of how the position offered reflects their expertise and experience and how the role that they will play on the project is suitable (for example, an undergraduate student is unlikely to lead a research project on their own)\n\nGlobal Case Management System (GCMS) fields to review in the offer of employment\n--------------------------------------------------------------------------------\n\n| Field | Considerations |\n| --- | --- |\n| LMIA Exemption Code | C52 – the employer should have selected this code Ensure that the exemption code matches the description in ‘Requirements Exemptions met’ |\n| Requirements Exemptions Met | Information in this field should outline * what the academic award is * how the foreign national meets the award criteria * how the foreign national will contribute to the research project * the academic or educational institution the foreign national is affiliated with if the employer is not themselves, such an institution Please note that the information regarding how the employer and applicant meet the LMIA-exemption category requirements may be in an attachment to the offer. |\n| NOC | ##### The National Occupational Classification (NOC) code should be for the occupation that matches the foreign national’s prospective duties |\n| Duties | These are the activities that the foreign national will be performing. Do they align with the occupation and what is described in the [National Occupational Classification](https://noc.esdc.gc.ca/)? |\n| Job Requirements | Are there specific requirements that align with the exemption? For example, they must hold a specific degree or they must have specific experience. |\n\nAwards funded by Canadian institutions\n--------------------------------------\n\n* The award must be given based on merit and academic excellence.\n* The award must be the result of a competitive assessment and review process. \n * The onus is on the applicant to provide details, such as, to whom the award was open (for example, criteria for eligibility); how the applicant came to participate in the award process (for example, nomination, self-submission); and the criteria or process used to select the winner(s).\n\n* The award must **not** be primarily for recruitment or commercial purposes.\n* Included in this category are [Global Affairs Canada (GAC) award programs](http://www.scholarships-bourses.gc.ca/scholarships-bourses/non_can/opportunities-opportunites.aspx?lang=eng), where the recipients do not qualify for a study permit and do require a work permit.\n\nAwards funded by foreign institutions\n-------------------------------------\n\nAcademic research award recipients who are supported by their own country or institution, and are invited by Canadian institutions to conduct research activities in Canada, may also be eligible for this exemption.\n\nSelf-funded research\n--------------------\n\nIn addition, certain foreign nationals seeking to carry out self-funded research may meet the [definition of a business visitor](https://ircc.canada.ca/english/helpcentre/answer.asp?qnum=434&top=16) and thus be eligible to work without obtaining a work permit. For foreign nationals doing self-funded research to be considered business visitors, officers must be satisfied that they meet the [criteria for the business visitor category](https://www.canada.ca/en/immigration-refugees-citizenship/corporate/publications-manuals/operational-bulletins-manuals/temporary-residents/foreign-workers/work-without-permit/business.html).\n\nRefer to [Study permits: Off-campus work](https://www.canada.ca/en/immigration-refugees-citizenship/corporate/publications-manuals/operational-bulletins-manuals/temporary-residents/study-permits/campus-work.html) for guidance.\n\nPrevious updates\n----------------\n\n[July 12, 2016 - Update to instructions related to post-doctoral fellows awarded a Doctorate of Philosophy and award recipients [C44]](https://www.canada.ca/en/immigration-refugees-citizenship/corporate/publications-manuals/operational-bulletins-manuals/updates/2016-07-12.html)\n\nPage details\n------------\n\n 2024-12-24",
  "sections": [
    {
      "heading": "Academic award recipients for research work – [R205(c)(ii) – C52] – Canadian interest – International Mobility Program",
      "heading_path": [
        "Academic award recipients for research work – [R205(c)(ii) – C52] – Canadian interest – International Mobility Program"
      ],
      "anchor": "#academic-award-recipients-for-research-work-r205-c-ii-c52-canadian-interest-international-mobility-program",
      "text": "Published Time: Thu, 12 Feb 2026 00:43:31 GMT\n\nAcademic award recipients for research work – [R205(c)(ii) – C52] – Canadian interest – International Mobility Program\n======================================================================================================================\n\nThis section contains policy, procedures and guidance used by IRCC staff. It is posted on the department’s website as a courtesy to stakeholders.\n\nEffective immediately, most foreign nationals in Canada are no longer eligible to apply for a work permit at a port of entry.\n\nThe following work permit applications are exempt from the above restrictions and may still be accepted for processing at a port of entry:\n\n* **applicants who are citizens or permanent residents of the United States of America (USA)**\n* **professionals and technicians under free trade agreements (FTAs)**\n * professionals under the FTA with the USA and Mexico (T36)\n * professionals under the FTA with Chile (F22)\n * contractual service suppliers or independent professionals under the FTA with South Korea (F32)\n * professionals under the FTA with Panama (F42)\n * professionals or technicians under the FTA with Colombia (F12)\n * professionals or technicians under the FTA with Peru (F52)\n\n* **spouses or common-law partners**of applicants under the FTAs with South Korea (F32), Panama (F42) and Colombia (F12)\n* **truck drivers** who are required to depart Canada for the purpose of their employment and, prior to their departure from Canada, held a work permit or maintained status as a result of a pending application for work permit renewal (this does not include truck drivers operating solely within Canada)\n* **applicants with pre-scheduled Canada Border Services Agency (CBSA) appointments**\n\nIn these instructions, “officer” refers to employees of both Immigration, Refugees and Citizenship Canada (IRCC) and the Canada Border Services Agency.\n\nThe instructions on this page should be reviewed in conjunction with\n\n* [Employer-specific work permits — General processing — International Mobility Program](https://www.canada.ca/en/immigration-refugees-citizenship/corporate/publications-manuals/operational-bulletins-manuals/temporary-residents/foreign-workers/eligibility/employer-specific-labout-market-impact-assessment-exemptions.html)\n* [Conditions and validity period on work permits](https://www.canada.ca/en/immigration-refugees-citizenship/corporate/publications-manuals/operational-bulletins-manuals/temporary-residents/foreign-workers/eligibility/eligibility-admissibility-conditions-including-validity-period.html)\n* [Public list of Employers who have been non-compliant](https://www.canada.ca/en/immigration-refugees-citizenship/corporate/publications-manuals/operational-bulletins-manuals/temporary-residents/foreign-workers/eligibility/public-list-employers-who-have-been-non-compliant.html)\n\nThe Minister has designated the work performed by foreign nationals who have received a reward for academic excellence as necessary for public policy reasons related to the competitiveness of Canada’s academic institutions, or economy, under [subparagraph 205(c)(ii) of the Immigration and Refugee Protection Regulations (IRPR)](https://laws-lois.justice.gc.ca/eng/regulations/SOR-2002-227/section-205.html).\n\nOn this page\n------------\n\n* [Eligibility](https://www.canada.ca/en/immigration-refugees-citizenship/corporate/publications-manuals/operational-bulletins-manuals/temporary-residents/foreign-workers/public-policy-competitiveness-economy/c52.html#eligibility)\n* [Documentary evidence](https://www.canada.ca/en/immigration-refugees-citizenship/corporate/publications-manuals/operational-bulletins-manuals/temporary-residents/foreign-workers/public-policy-competitiveness-economy/c52.html#documentary-evidence)\n* [Global Case Management System (GCMS) fields to review in the offer of employment](https://www.canada.ca/en/immigration-refugees-citizenship/corporate/publications-manuals/operational-bulletins-manuals/temporary-residents/foreign-workers/public-policy-competitiveness-economy/c52.html#gcms)\n* [Awards funded by Canadian institutions](https://www.canada.ca/en/immigration-refugees-citizenship/corporate/publications-manuals/operational-bulletins-manuals/temporary-residents/foreign-workers/public-policy-competitiveness-economy/c52.html#award)\n* [Awards funded by foreign institutions](https://www.canada.ca/en/immigration-refugees-citizenship/corporate/publications-manuals/operational-bulletins-manuals/temporary-residents/foreign-workers/public-policy-competitiveness-economy/c52.html#award-1)\n* [Self-funded research](https://www.canada.ca/en/immigration-refugees-citizenship/corporate/publications-manuals/operational-bulletins-manuals/temporary-residents/foreign-workers/public-policy-competitiveness-economy/c52.html#research)\n* [Previous updates](https://www.canada.ca/en/immigration-refugees-citizenship/corporate/publications-manuals/operational-bulletins-manuals/temporary-residents/foreign-workers/public-policy-competitiveness-economy/c52.html#updates)\n\nFor the purposes of the administrative code C52, IRCC defines “academic award” as an award that involves research work, including remuneration, offered by a Canadian academic institution. An academic award is granted strictly on the basis of academic excellence.\n\nEligibility\n-----------\n\nTo be eligible for a work permit issued under administrative code C52, a foreign national must\n\n* be the direct recipient of the award involving work and remuneration\n* hold an official position or an affiliation or registration with a credible academic or educational institution or agency in their country of citizenship or residence\n* demonstrate academic excellence or expertise in a field related to the particular work to be undertaken\n* be offered a position by a credible Canadian academic or educational institution or agency, or a closely affiliated organization \n * The employer must not be a commercial enterprise.\n * For institutions or agencies not on the [designated learning institutions list](https://www.canada.ca/en/immigration-refugees-citizenship/corporate/publications-manuals/operational-bulletins-manuals/temporary-residents/study-permits/designated-learning-institutions.html), see also [Scholarships for international students](https://www.international.gc.ca/world-monde/study_work_travel-etude_travail_voyage/scholarships-bourses.aspx?lang=eng).\n * be offered a position that reflects their experience and expertise and that will have a significant role that will actively contribute to and benefit a Canadian research project\n\n**Note:** Credibility of the employer may be assessed by examining the mandate and capacity of the institution or agency. Is its primary function to engage in research activities or advance education or policy? Does it possess the capacity (for example, resources, expertise, network) to conduct or support research activities? What is its source of funds (for example, government, commercial enterprise)? What kind of reputation does the institution or agency have?\n\nDocumentary evidence\n--------------------\n\nThe following documents should be submitted with the work permit application:\n\n* either \n * an offer of employment number generated by the Employer Portal when the Canadian institution submits the offer, or\n * the Offer of Employment to a Foreign National Exempt from a Labour Market Impact Assessment (LMIA) form [IMM 5802] **if authorized** for the Canadian institution to use by the Client Experience Branch or Immigration Program Guidance Branch to submit the form (see [Alternate submission [IMM 5802]](https://www.canada.ca/en/immigration-refugees-citizenship/corporate/publications-manuals/operational-bulletins-manuals/temporary-residents/foreign-workers/eligibility/employer-specific-labout-market-impact-assessment-exemptions.html#t4) for details)\n\n* proof of payment of the employer compliance fee\n* evidence of the award received (letter from the entity providing the award that details how it meets the award criteria) \n* evidence of how the position offered reflects their expertise and experience and how the role that they will play on the project is suitable (for example, an undergraduate student is unlikely to lead a research project on their own)\n\nGlobal Case Management System (GCMS) fields to review in the offer of employment\n--------------------------------------------------------------------------------\n\n| Field | Considerations |\n| --- | --- |\n| LMIA Exemption Code | C52 – the employer should have selected this code Ensure that the exemption code matches the description in ‘Requirements Exemptions met’ |\n| Requirements Exemptions Met | Information in this field should outline * what the academic award is * how the foreign national meets the award criteria * how the foreign national will contribute to the research project * the academic or educational institution the foreign national is affiliated with if the employer is not themselves, such an institution Please note that the information regarding how the employer and applicant meet the LMIA-exemption category requirements may be in an attachment to the offer. |\n| NOC | ##### The National Occupational Classification (NOC) code should be for the occupation that matches the foreign national’s prospective duties |\n| Duties | These are the activities that the foreign national will be performing. Do they align with the occupation and what is described in the [National Occupational Classification](https://noc.esdc.gc.ca/)? |\n| Job Requirements | Are there specific requirements that align with the exemption? For example, they must hold a specific degree or they must have specific experience. |\n\nAwards funded by Canadian institutions\n--------------------------------------\n\n* The award must be given based on merit and academic excellence.\n* The award must be the result of a competitive assessment and review process. \n * The onus is on the applicant to provide details, such as, to whom the award was open (for example, criteria for eligibility); how the applicant came to participate in the award process (for example, nomination, self-submission); and the criteria or process used to select the winner(s).\n\n* The award must **not** be primarily for recruitment or commercial purposes.\n* Included in this category are [Global Affairs Canada (GAC) award programs](http://www.scholarships-bourses.gc.ca/scholarships-bourses/non_can/opportunities-opportunites.aspx?lang=eng), where the recipients do not qualify for a study permit and do require a work permit.\n\nAwards funded by foreign institutions\n-------------------------------------\n\nAcademic research award recipients who are supported by their own country or institution, and are invited by Canadian institutions to conduct research activities in Canada, may also be eligible for this exemption.\n\nSelf-funded research\n--------------------\n\nIn addition, certain foreign nationals seeking to carry out self-funded research may meet the [definition of a business visitor](https://ircc.canada.ca/english/helpcentre/answer.asp?qnum=434&top=16) and thus be eligible to work without obtaining a work permit. For foreign nationals doing self-funded research to be considered business visitors, officers must be satisfied that they meet the [criteria for the business visitor category](https://www.canada.ca/en/immigration-refugees-citizenship/corporate/publications-manuals/operational-bulletins-manuals/temporary-residents/foreign-workers/work-without-permit/business.html).\n\nRefer to [Study permits: Off-campus work](https://www.canada.ca/en/immigration-refugees-citizenship/corporate/publications-manuals/operational-bulletins-manuals/temporary-residents/study-permits/campus-work.html) for guidance.\n\nPrevious updates\n----------------\n\n[July 12, 2016 - Update to instructions related to post-doctoral fellows awarded a Doctorate of Philosophy and award recipients [C44]](https://www.canada.ca/en/immigration-refugees-citizenship/corporate/publications-manuals/operational-bulletins-manuals/updates/2016-07-12.html)\n\nPage details\n------------\n\n 2024-12-24"
    }
  ],
  "links": {
    "outbound": [
      "https://www.canada.ca/en/immigration-refugees-citizenship/corporate/publications-manuals/operational-bulletins-manuals/temporary-residents/foreign-workers/eligibility/employer-specific-labout-market-impact-assessment-exemptions.html",
      "https://www.canada.ca/en/immigration-refugees-citizenship/corporate/publications-manuals/operational-bulletins-manuals/temporary-residents/foreign-workers/eligibility/eligibility-admissibility-conditions-including-validity-period.html",
      "https://www.canada.ca/en/immigration-refugees-citizenship/corporate/publications-manuals/operational-bulletins-manuals/temporary-residents/foreign-workers/eligibility/public-list-employers-who-have-been-non-compliant.html",
      "https://laws-lois.justice.gc.ca/eng/regulations/SOR-2002-227/section-205.html",
      "https://www.canada.ca/en/immigration-refugees-citizenship/corporate/publications-manuals/operational-bulletins-manuals/temporary-residents/foreign-workers/public-policy-competitiveness-economy/c52.html",
      "https://www.canada.ca/en/immigration-refugees-citizenship/corporate/publications-manuals/operational-bulletins-manuals/temporary-residents/study-permits/designated-learning-institutions.html",
      "https://www.international.gc.ca/world-monde/study_work_travel-etude_travail_voyage/scholarships-bourses.aspx?lang=eng",
      "https://noc.esdc.gc.ca/",
      "http://www.scholarships-bourses.gc.ca/scholarships-bourses/non_can/opportunities-opportunites.aspx?lang=eng",
      "https://ircc.canada.ca/english/helpcentre/answer.asp?qnum=434&top=16",
      "https://www.canada.ca/en/immigration-refugees-citizenship/corporate/publications-manuals/operational-bulletins-manuals/temporary-residents/foreign-workers/work-without-permit/business.html",
      "https://www.canada.ca/en/immigration-refugees-citizenship/corporate/publications-manuals/operational-bulletins-manuals/temporary-residents/study-permits/campus-work.html"
    ],
    "internal_children": []
  },
  "quality": {
    "is_toc_like": false,
    "is_low_text": false,
    "notes": []
  }
}