{
  "source_id": "pdi_572070f4b536",
  "source_type": "guidance_pdi",
  "source_url": "https://www.canada.ca/en/immigration-refugees-citizenship/corporate/publications-manuals/operational-bulletins-manuals/temporary-residents/foreign-workers/work-without-permit/changes-work-permits-issued-caregivers.html",
  "canonical_url": "https://www.canada.ca/en/immigration-refugees-citizenship/corporate/publications-manuals/operational-bulletins-manuals/temporary-residents/foreign-workers/work-without-permit/changes-work-permits-issued-caregivers.html",
  "title": "Work permits for caregiver pathways – Temporary Foreign Worker Program and International Mobility Program",
  "language": "en",
  "manual": "Work permits for caregiver pathways – Temporary Foreign Worker Program and International Mobility Program",
  "chapter": null,
  "heading_path": [
    "Work permits for caregiver pathways – Temporary Foreign Worker Program and International Mobility Program"
  ],
  "last_updated": "2023-07-04",
  "crawl_ts": "2026-02-12T00:00:00Z",
  "http": {
    "status_code": 200,
    "content_type": "text/markdown"
  },
  "content_hash": "ee4d92b55869bdeb62f54f376c7e14ea0678bd1d699bd74dcf464fec9a97668a",
  "raw_html_path": null,
  "markdown_path": "scripts/scraper/ircc_data_clean/changes-work-permits-issued-caregivers-572070f4b5.md",
  "text": "Published Time: Thu, 12 Feb 2026 00:37:11 GMT\n\nWork permits for caregiver pathways – Temporary Foreign Worker Program and International Mobility Program\n=========================================================================================================\n\nIRCC implemented several different pathways for caregivers after the zero cap on the Live-in Caregiver Program (LCP) was imposed on November 30, 2014. The Immigration and Refugee Protection Regulations (IRPR) were subsequently changed to remove the LCP.\n\nThis page provides a brief overview of the different work permits available for each pathway. For a quick reference, refer to the [Caregiver temporary residence programs comparison table (PDF, 282 KB)](https://www.canada.ca/content/dam/ircc/documents/pdf/english/corporate/publications-manuals/tr-caregiver-options-comparable-eng.pdf).\n\nOn this page\n------------\n\n* [Home Child Care Provider Pilot and Home Support Worker Pilot (June 18, 2019 to June 17,2024)](https://www.canada.ca/en/immigration-refugees-citizenship/corporate/publications-manuals/operational-bulletins-manuals/temporary-residents/foreign-workers/work-without-permit/changes-work-permits-issued-caregivers.html#s1)\n* [Interim Pathway for Caregivers (March 4 to October 8, 2019)](https://www.canada.ca/en/immigration-refugees-citizenship/corporate/publications-manuals/operational-bulletins-manuals/temporary-residents/foreign-workers/work-without-permit/changes-work-permits-issued-caregivers.html#s2)\n* [Caring for children pilot and Caring for people with high medical needs pilot (November 30, 2014 to June 17, 2019)](https://www.canada.ca/en/immigration-refugees-citizenship/corporate/publications-manuals/operational-bulletins-manuals/temporary-residents/foreign-workers/work-without-permit/changes-work-permits-issued-caregivers.html#s3)\n* [Live-in Caregiver Program(LCP) before November 30, 2014](https://www.canada.ca/en/immigration-refugees-citizenship/corporate/publications-manuals/operational-bulletins-manuals/temporary-residents/foreign-workers/work-without-permit/changes-work-permits-issued-caregivers.html#s4)\n* [Work permit applications under the Temporary Foreign Worker Program(TFWP) without a pathway to permanent residence](https://www.canada.ca/en/immigration-refugees-citizenship/corporate/publications-manuals/operational-bulletins-manuals/temporary-residents/foreign-workers/work-without-permit/changes-work-permits-issued-caregivers.html#s6)\n\nHome Child Care Provider Pilot and Home Support Worker Pilot (June 18, 2019 to June 17,2024)\n--------------------------------------------------------------------------------------------\n\nOn June 18, 2019, [ministerial instructions](https://www.canada.ca/en/immigration-refugees-citizenship/corporate/mandate/policies-operational-instructions-agreements/ministerial-instructions/other-goals/mi32.html) (MIs) were issued to create 2 new permanent residence pilots for caregivers. The MIs were changed on April 30, 2023. The pilots are\n\n* the Home Child Care Provider Pilot (HCCPP)\n* the Home Support Worker Pilot (HSWP)\n\nThe pilots are only for the [National Occupational Classification](https://noc.esdc.gc.ca/) (NOC) codes:\n\nBefore November 16, 2022\n\n* HCCPP: NOC 4411 \n* HSWP: NOC 4412\n\nNovember 16, 2022 and after\n\n* HCCPP: NOC 44100 \n* HSWP: NOC 44101\n\nThe permanent residence requirements for the 2 permanent residence pilots are assessed upfront, except for the eligible Canadian work experience, unless the applicant has already acquired it.\n\nApplicants who do not have the work experience are issued an occupation-restricted open employer work permit under paragraph 205(a) of the IRPR (administrative code C90). The work permit allows applicants to work for any employer under NOC code 4411 or 4412 (NOC 2016) or NOC 44100 or 44101 (NOC 2021).\n\nApplicants who receive an approval in principle on their permanent residence application under the caregiver pilots are eligible to apply for a [bridging open work permit](https://www.canada.ca/en/immigration-refugees-citizenship/corporate/publications-manuals/operational-bulletins-manuals/temporary-residents/foreign-workers/provincial-nominees-permanent-resident-applicants/bridging-open-work-permits.html).\n\nFor instructions:\n\n* [Occupation-restricted open work permits under the Home Child Care Provider Pilot or Home Support Worker Pilot – Category A applicants [R205(a) – C90] – International Mobility Program](https://www.canada.ca/en/immigration-refugees-citizenship/corporate/publications-manuals/operational-bulletins-manuals/permanent-residence/economic-classes/pathways-for-caregivers/child-care-provider-support-pilots/occupation-restricted-open-work.html)\n* [Bridging open work permits for certain economic class permanent residence applicants [R205(a) - A75] – International Mobility Program](https://www.canada.ca/en/immigration-refugees-citizenship/corporate/publications-manuals/operational-bulletins-manuals/temporary-residents/foreign-workers/provincial-nominees-permanent-resident-applicants/bridging-open-work-permits.html)\n\nInterim Pathway for Caregivers (March 4 to October 8, 2019)\n-----------------------------------------------------------\n\nThe public policy under section 25.2 of the Immigration and Refugee Protection Act for the [Interim Pathway for Caregivers](https://www.canada.ca/en/immigration-refugees-citizenship/corporate/mandate/policies-operational-instructions-agreements/interim-pathway-caregivers-july.html) permanent resident program was only valid from March 4 to June 4, 2019, and then from July 8 to October 8, 2019. It is now **closed to new applications**.\n\nApplicants who have received a positive eligibility assessment of their application for permanent residence under the Interim Pathway for Caregivers public policy are eligible for an open work permit under paragraph R207(d) (Labour Market Impact Assessment [LMIA] exemption code A70).\n\nFor instructions:\n\n* [Open work permits for applicants under the Interim Pathway for Caregivers](https://www.canada.ca/en/immigration-refugees-citizenship/corporate/publications-manuals/operational-bulletins-manuals/temporary-residents/foreign-workers/special-initiatives-pilot-project/permits-for-interim-pathway.html)\n\nCaring for children pilot and caring for people with high medical needs pilot (November 30, 2014, to June 17, 2019)\n-------------------------------------------------------------------------------------------------------------------\n\nThe [caring for children and caring for people with high medical needs classes](https://www.canada.ca/en/immigration-refugees-citizenship/corporate/publications-manuals/operational-bulletins-manuals/permanent-residence/economic-classes/caring-children-caring-people-high-medical-needs.html) are 2 economic pilot programs targeted to foreign nationals who have had at least 2 years of full-time Canadian work experience in an eligible caregiver occupation, and who meet the minimum education and language proficiency requirements.\n\nThe program was implemented through [MIs](http://www.gazette.gc.ca/rp-pr/p1/2014/2014-11-29/html/notice-avis-eng.php) issued on November 30, 2014.\n\nPermanent residence applicants in these pilots may be eligible for a bridging open work permit under paragraph R205(a) (LMIA exemption code A75).\n\nFor instructions:\n\n* [Bridging open work permits for certain economic class permanent residence applicants [R205(a) - A75] – International Mobility Program](https://www.canada.ca/en/immigration-refugees-citizenship/corporate/publications-manuals/operational-bulletins-manuals/temporary-residents/foreign-workers/provincial-nominees-permanent-resident-applicants/bridging-open-work-permits.html)\n\nLive-in Caregiver Program(LCP) before November 30, 2014\n-------------------------------------------------------\n\nGiven that one of the permanent residence requirements, under the repealed section R113 was for live-in caregivers to obtain their work experience within the 4 years immediately following their entry to Canada, the total duration of all LCP work permits (added together) should not exceed **4 years and 3 months. All LCP work permit holders should now have met their 4-year cap**and must have applied for permanent residence to obtain an open work permit under [LMIA exemption code A71](https://www.canada.ca/en/immigration-refugees-citizenship/corporate/publications-manuals/operational-bulletins-manuals/permanent-residence/economic-classes/live-caregivers/assessing-eligibility-become-member-live-caregiver-class.html).\n\nThe 4-year cap does not include open work permits issued for live-in caregivers who currently have an LCP permanent residence application in processing under [LMIA exemption code A71](https://www.canada.ca/en/immigration-refugees-citizenship/corporate/publications-manuals/operational-bulletins-manuals/permanent-residence/economic-classes/live-caregivers/assessing-eligibility-become-member-live-caregiver-class.html).\n\n**Note:** If the live-in caregiver has reached the limit and is applying for an extension or a new work permit under the program, the Case Processing Centre in Edmonton should refer the case to the relevant IRCC local office for further assessment as per section 8, Chapter 4 of the Inland Processing (IP) manual.\n\nOfficers should confirm that\n\n* the LMIA was issued for 6474 (NOC 2006) or 4411 (NOC 2011/2016)\n* the live-in requirement is met\n\n* the initial LCP work permit was issued based on an LMIA received on or before November 30, 2014\n* **less than** 4 years and 3 months have elapsed since the initial LCP work permit was issued\n\nIn these circumstances, the officer should use the special program code “LCP” when issuing work permit renewals, with “Case Type” code 57.\n\nThese applications for renewal must continue to be processed against the criteria listed in the [repealed section R112](http://laws-lois.justice.gc.ca/eng/regulations/SOR-2002-227/section-112.html).\n\nForeign nationals who have submitted an application for permanent residence under the LCP may be eligible for an open work permit under [LMIA exemption code A71](https://www.canada.ca/en/immigration-refugees-citizenship/corporate/publications-manuals/operational-bulletins-manuals/permanent-residence/economic-classes/live-caregivers/assessing-eligibility-become-member-live-caregiver-class.html).\n\nFind more information on how to [determine the receipt date for an LMIA](https://www.canada.ca/en/immigration-refugees-citizenship/corporate/publications-manuals/operational-bulletins-manuals/temporary-residents/foreign-workers/work-without-permit/changes-work-permits-issued-caregivers/refusal-to-process.html).\n\nWork permit applications under the Temporary Foreign Worker Program(TFWP) without a pathway to permanent residence\n------------------------------------------------------------------------------------------------------------------\n\n**Note:** The instructions in this section also apply to LMIA-required work permit applications received on or after June 18, 2019.\n\nSince November 30, 2014, foreign nationals who have job offers and LMIAs for in-home caregiving occupations (live-in and live-out) have had their work permits assessed and processed as part of the general temporary foreign worker stream.\n\nMIs implemented on [June 18, 2019](http://gazette.gc.ca/rp-pr/p1/2019/2019-06-29/html/notice-avis-eng.html), and revised on April 22, 2022, instruct officers to refuse to process work permit applications received under the TFWP for caregiver occupations in specific circumstances.\n\nThe [revised MIs](https://www.canada.ca/en/immigration-refugees-citizenship/corporate/mandate/policies-operational-instructions-agreements/ministerial-instructions/other-goals/mi-52.html)\n\n* clarify that the refusal to process work permit applications for the specific occupations (NOC 4411 and 4412 [NOC 2016]) or NOC 44100 or 44101 [NOC 2021] – home child care workers and home support workers) includes applications submitted at ports of entry\n* prevent foreign nationals currently not authorized to work or study (whether they are physically within or outside Canada) from obtaining a new caregiver work permit under the TFWP unless they are exempt\n\nFor instructions:\n\n* [Refusal to process LMIA-required work permit applications for caregivers received on or after June 18, 2019](https://www.canada.ca/en/immigration-refugees-citizenship/corporate/publications-manuals/operational-bulletins-manuals/temporary-residents/foreign-workers/work-without-permit/changes-work-permits-issued-caregivers/refusal-to-process.html)\n\nIn-home caregivers who have an approved employer for LMIA applications submitted to Employment and Social Development Canada (ESDC) on or after November 30, 2014, and who are not impacted by the refusal to process implemented by the MIs on June 18, 2019, and revised on April 22, 2022, may be eligible to obtain a work permit under the TFWP.\n\nForeign nationals who are not impacted by the refusal to process are named in an approved LMIA submitted to ESDC after June 18, 2019, and\n\n* are in Canada with a job offer located anywhere in Canada and are renewing a work permit with a caregiver occupation or\n* are in or outside Canada with a job offer located in Quebec for a caregiver occupation\n\nIn these circumstances, officers must use the\n\n* special program code: **LSP**(do **not** use LCP)\n* case type: **code 53**\n\nPage details\n------------\n\n 2023-07-04",
  "sections": [
    {
      "heading": "Work permits for caregiver pathways – Temporary Foreign Worker Program and International Mobility Program",
      "heading_path": [
        "Work permits for caregiver pathways – Temporary Foreign Worker Program and International Mobility Program"
      ],
      "anchor": "#work-permits-for-caregiver-pathways-temporary-foreign-worker-program-and-international-mobility-program",
      "text": "Published Time: Thu, 12 Feb 2026 00:37:11 GMT\n\nWork permits for caregiver pathways – Temporary Foreign Worker Program and International Mobility Program\n=========================================================================================================\n\nIRCC implemented several different pathways for caregivers after the zero cap on the Live-in Caregiver Program (LCP) was imposed on November 30, 2014. The Immigration and Refugee Protection Regulations (IRPR) were subsequently changed to remove the LCP.\n\nThis page provides a brief overview of the different work permits available for each pathway. For a quick reference, refer to the [Caregiver temporary residence programs comparison table (PDF, 282 KB)](https://www.canada.ca/content/dam/ircc/documents/pdf/english/corporate/publications-manuals/tr-caregiver-options-comparable-eng.pdf).\n\nOn this page\n------------\n\n* [Home Child Care Provider Pilot and Home Support Worker Pilot (June 18, 2019 to June 17,2024)](https://www.canada.ca/en/immigration-refugees-citizenship/corporate/publications-manuals/operational-bulletins-manuals/temporary-residents/foreign-workers/work-without-permit/changes-work-permits-issued-caregivers.html#s1)\n* [Interim Pathway for Caregivers (March 4 to October 8, 2019)](https://www.canada.ca/en/immigration-refugees-citizenship/corporate/publications-manuals/operational-bulletins-manuals/temporary-residents/foreign-workers/work-without-permit/changes-work-permits-issued-caregivers.html#s2)\n* [Caring for children pilot and Caring for people with high medical needs pilot (November 30, 2014 to June 17, 2019)](https://www.canada.ca/en/immigration-refugees-citizenship/corporate/publications-manuals/operational-bulletins-manuals/temporary-residents/foreign-workers/work-without-permit/changes-work-permits-issued-caregivers.html#s3)\n* [Live-in Caregiver Program(LCP) before November 30, 2014](https://www.canada.ca/en/immigration-refugees-citizenship/corporate/publications-manuals/operational-bulletins-manuals/temporary-residents/foreign-workers/work-without-permit/changes-work-permits-issued-caregivers.html#s4)\n* [Work permit applications under the Temporary Foreign Worker Program(TFWP) without a pathway to permanent residence](https://www.canada.ca/en/immigration-refugees-citizenship/corporate/publications-manuals/operational-bulletins-manuals/temporary-residents/foreign-workers/work-without-permit/changes-work-permits-issued-caregivers.html#s6)\n\nHome Child Care Provider Pilot and Home Support Worker Pilot (June 18, 2019 to June 17,2024)\n--------------------------------------------------------------------------------------------\n\nOn June 18, 2019, [ministerial instructions](https://www.canada.ca/en/immigration-refugees-citizenship/corporate/mandate/policies-operational-instructions-agreements/ministerial-instructions/other-goals/mi32.html) (MIs) were issued to create 2 new permanent residence pilots for caregivers. The MIs were changed on April 30, 2023. The pilots are\n\n* the Home Child Care Provider Pilot (HCCPP)\n* the Home Support Worker Pilot (HSWP)\n\nThe pilots are only for the [National Occupational Classification](https://noc.esdc.gc.ca/) (NOC) codes:\n\nBefore November 16, 2022\n\n* HCCPP: NOC 4411 \n* HSWP: NOC 4412\n\nNovember 16, 2022 and after\n\n* HCCPP: NOC 44100 \n* HSWP: NOC 44101\n\nThe permanent residence requirements for the 2 permanent residence pilots are assessed upfront, except for the eligible Canadian work experience, unless the applicant has already acquired it.\n\nApplicants who do not have the work experience are issued an occupation-restricted open employer work permit under paragraph 205(a) of the IRPR (administrative code C90). The work permit allows applicants to work for any employer under NOC code 4411 or 4412 (NOC 2016) or NOC 44100 or 44101 (NOC 2021).\n\nApplicants who receive an approval in principle on their permanent residence application under the caregiver pilots are eligible to apply for a [bridging open work permit](https://www.canada.ca/en/immigration-refugees-citizenship/corporate/publications-manuals/operational-bulletins-manuals/temporary-residents/foreign-workers/provincial-nominees-permanent-resident-applicants/bridging-open-work-permits.html).\n\nFor instructions:\n\n* [Occupation-restricted open work permits under the Home Child Care Provider Pilot or Home Support Worker Pilot – Category A applicants [R205(a) – C90] – International Mobility Program](https://www.canada.ca/en/immigration-refugees-citizenship/corporate/publications-manuals/operational-bulletins-manuals/permanent-residence/economic-classes/pathways-for-caregivers/child-care-provider-support-pilots/occupation-restricted-open-work.html)\n* [Bridging open work permits for certain economic class permanent residence applicants [R205(a) - A75] – International Mobility Program](https://www.canada.ca/en/immigration-refugees-citizenship/corporate/publications-manuals/operational-bulletins-manuals/temporary-residents/foreign-workers/provincial-nominees-permanent-resident-applicants/bridging-open-work-permits.html)\n\nInterim Pathway for Caregivers (March 4 to October 8, 2019)\n-----------------------------------------------------------\n\nThe public policy under section 25.2 of the Immigration and Refugee Protection Act for the [Interim Pathway for Caregivers](https://www.canada.ca/en/immigration-refugees-citizenship/corporate/mandate/policies-operational-instructions-agreements/interim-pathway-caregivers-july.html) permanent resident program was only valid from March 4 to June 4, 2019, and then from July 8 to October 8, 2019. It is now **closed to new applications**.\n\nApplicants who have received a positive eligibility assessment of their application for permanent residence under the Interim Pathway for Caregivers public policy are eligible for an open work permit under paragraph R207(d) (Labour Market Impact Assessment [LMIA] exemption code A70).\n\nFor instructions:\n\n* [Open work permits for applicants under the Interim Pathway for Caregivers](https://www.canada.ca/en/immigration-refugees-citizenship/corporate/publications-manuals/operational-bulletins-manuals/temporary-residents/foreign-workers/special-initiatives-pilot-project/permits-for-interim-pathway.html)\n\nCaring for children pilot and caring for people with high medical needs pilot (November 30, 2014, to June 17, 2019)\n-------------------------------------------------------------------------------------------------------------------\n\nThe [caring for children and caring for people with high medical needs classes](https://www.canada.ca/en/immigration-refugees-citizenship/corporate/publications-manuals/operational-bulletins-manuals/permanent-residence/economic-classes/caring-children-caring-people-high-medical-needs.html) are 2 economic pilot programs targeted to foreign nationals who have had at least 2 years of full-time Canadian work experience in an eligible caregiver occupation, and who meet the minimum education and language proficiency requirements.\n\nThe program was implemented through [MIs](http://www.gazette.gc.ca/rp-pr/p1/2014/2014-11-29/html/notice-avis-eng.php) issued on November 30, 2014.\n\nPermanent residence applicants in these pilots may be eligible for a bridging open work permit under paragraph R205(a) (LMIA exemption code A75).\n\nFor instructions:\n\n* [Bridging open work permits for certain economic class permanent residence applicants [R205(a) - A75] – International Mobility Program](https://www.canada.ca/en/immigration-refugees-citizenship/corporate/publications-manuals/operational-bulletins-manuals/temporary-residents/foreign-workers/provincial-nominees-permanent-resident-applicants/bridging-open-work-permits.html)\n\nLive-in Caregiver Program(LCP) before November 30, 2014\n-------------------------------------------------------\n\nGiven that one of the permanent residence requirements, under the repealed section R113 was for live-in caregivers to obtain their work experience within the 4 years immediately following their entry to Canada, the total duration of all LCP work permits (added together) should not exceed **4 years and 3 months. All LCP work permit holders should now have met their 4-year cap**and must have applied for permanent residence to obtain an open work permit under [LMIA exemption code A71](https://www.canada.ca/en/immigration-refugees-citizenship/corporate/publications-manuals/operational-bulletins-manuals/permanent-residence/economic-classes/live-caregivers/assessing-eligibility-become-member-live-caregiver-class.html).\n\nThe 4-year cap does not include open work permits issued for live-in caregivers who currently have an LCP permanent residence application in processing under [LMIA exemption code A71](https://www.canada.ca/en/immigration-refugees-citizenship/corporate/publications-manuals/operational-bulletins-manuals/permanent-residence/economic-classes/live-caregivers/assessing-eligibility-become-member-live-caregiver-class.html).\n\n**Note:** If the live-in caregiver has reached the limit and is applying for an extension or a new work permit under the program, the Case Processing Centre in Edmonton should refer the case to the relevant IRCC local office for further assessment as per section 8, Chapter 4 of the Inland Processing (IP) manual.\n\nOfficers should confirm that\n\n* the LMIA was issued for 6474 (NOC 2006) or 4411 (NOC 2011/2016)\n* the live-in requirement is met\n\n* the initial LCP work permit was issued based on an LMIA received on or before November 30, 2014\n* **less than** 4 years and 3 months have elapsed since the initial LCP work permit was issued\n\nIn these circumstances, the officer should use the special program code “LCP” when issuing work permit renewals, with “Case Type” code 57.\n\nThese applications for renewal must continue to be processed against the criteria listed in the [repealed section R112](http://laws-lois.justice.gc.ca/eng/regulations/SOR-2002-227/section-112.html).\n\nForeign nationals who have submitted an application for permanent residence under the LCP may be eligible for an open work permit under [LMIA exemption code A71](https://www.canada.ca/en/immigration-refugees-citizenship/corporate/publications-manuals/operational-bulletins-manuals/permanent-residence/economic-classes/live-caregivers/assessing-eligibility-become-member-live-caregiver-class.html).\n\nFind more information on how to [determine the receipt date for an LMIA](https://www.canada.ca/en/immigration-refugees-citizenship/corporate/publications-manuals/operational-bulletins-manuals/temporary-residents/foreign-workers/work-without-permit/changes-work-permits-issued-caregivers/refusal-to-process.html).\n\nWork permit applications under the Temporary Foreign Worker Program(TFWP) without a pathway to permanent residence\n------------------------------------------------------------------------------------------------------------------\n\n**Note:** The instructions in this section also apply to LMIA-required work permit applications received on or after June 18, 2019.\n\nSince November 30, 2014, foreign nationals who have job offers and LMIAs for in-home caregiving occupations (live-in and live-out) have had their work permits assessed and processed as part of the general temporary foreign worker stream.\n\nMIs implemented on [June 18, 2019](http://gazette.gc.ca/rp-pr/p1/2019/2019-06-29/html/notice-avis-eng.html), and revised on April 22, 2022, instruct officers to refuse to process work permit applications received under the TFWP for caregiver occupations in specific circumstances.\n\nThe [revised MIs](https://www.canada.ca/en/immigration-refugees-citizenship/corporate/mandate/policies-operational-instructions-agreements/ministerial-instructions/other-goals/mi-52.html)\n\n* clarify that the refusal to process work permit applications for the specific occupations (NOC 4411 and 4412 [NOC 2016]) or NOC 44100 or 44101 [NOC 2021] – home child care workers and home support workers) includes applications submitted at ports of entry\n* prevent foreign nationals currently not authorized to work or study (whether they are physically within or outside Canada) from obtaining a new caregiver work permit under the TFWP unless they are exempt\n\nFor instructions:\n\n* [Refusal to process LMIA-required work permit applications for caregivers received on or after June 18, 2019](https://www.canada.ca/en/immigration-refugees-citizenship/corporate/publications-manuals/operational-bulletins-manuals/temporary-residents/foreign-workers/work-without-permit/changes-work-permits-issued-caregivers/refusal-to-process.html)\n\nIn-home caregivers who have an approved employer for LMIA applications submitted to Employment and Social Development Canada (ESDC) on or after November 30, 2014, and who are not impacted by the refusal to process implemented by the MIs on June 18, 2019, and revised on April 22, 2022, may be eligible to obtain a work permit under the TFWP.\n\nForeign nationals who are not impacted by the refusal to process are named in an approved LMIA submitted to ESDC after June 18, 2019, and\n\n* are in Canada with a job offer located anywhere in Canada and are renewing a work permit with a caregiver occupation or\n* are in or outside Canada with a job offer located in Quebec for a caregiver occupation\n\nIn these circumstances, officers must use the\n\n* special program code: **LSP**(do **not** use LCP)\n* case type: **code 53**\n\nPage details\n------------\n\n 2023-07-04"
    }
  ],
  "links": {
    "outbound": [
      "https://www.canada.ca/content/dam/ircc/documents/pdf/english/corporate/publications-manuals/tr-caregiver-options-comparable-eng.pdf",
      "https://www.canada.ca/en/immigration-refugees-citizenship/corporate/publications-manuals/operational-bulletins-manuals/temporary-residents/foreign-workers/work-without-permit/changes-work-permits-issued-caregivers.html",
      "https://www.canada.ca/en/immigration-refugees-citizenship/corporate/mandate/policies-operational-instructions-agreements/ministerial-instructions/other-goals/mi32.html",
      "https://noc.esdc.gc.ca/",
      "https://www.canada.ca/en/immigration-refugees-citizenship/corporate/publications-manuals/operational-bulletins-manuals/temporary-residents/foreign-workers/provincial-nominees-permanent-resident-applicants/bridging-open-work-permits.html",
      "https://www.canada.ca/en/immigration-refugees-citizenship/corporate/mandate/policies-operational-instructions-agreements/interim-pathway-caregivers-july.html",
      "https://www.canada.ca/en/immigration-refugees-citizenship/corporate/publications-manuals/operational-bulletins-manuals/temporary-residents/foreign-workers/special-initiatives-pilot-project/permits-for-interim-pathway.html",
      "https://www.canada.ca/en/immigration-refugees-citizenship/corporate/publications-manuals/operational-bulletins-manuals/permanent-residence/economic-classes/caring-children-caring-people-high-medical-needs.html",
      "http://www.gazette.gc.ca/rp-pr/p1/2014/2014-11-29/html/notice-avis-eng.php",
      "https://www.canada.ca/en/immigration-refugees-citizenship/corporate/publications-manuals/operational-bulletins-manuals/permanent-residence/economic-classes/live-caregivers/assessing-eligibility-become-member-live-caregiver-class.html",
      "http://laws-lois.justice.gc.ca/eng/regulations/SOR-2002-227/section-112.html",
      "https://www.canada.ca/en/immigration-refugees-citizenship/corporate/publications-manuals/operational-bulletins-manuals/temporary-residents/foreign-workers/work-without-permit/changes-work-permits-issued-caregivers/refusal-to-process.html",
      "http://gazette.gc.ca/rp-pr/p1/2019/2019-06-29/html/notice-avis-eng.html",
      "https://www.canada.ca/en/immigration-refugees-citizenship/corporate/mandate/policies-operational-instructions-agreements/ministerial-instructions/other-goals/mi-52.html"
    ],
    "internal_children": []
  },
  "quality": {
    "is_toc_like": false,
    "is_low_text": false,
    "notes": []
  }
}